{
  "schemaVersion": 1,
  "updatedAt": "2026-10-23",
  "methodology": "Alphabetical directory, not a ranking. Controls summarize primary sources. Real-time labels describe author claims, not verified performance. License labels refer to selected weight model cards; unresolved conflicts are explicit. Listed endpoints do not guarantee access or live capacity.",
  "providers": [
    {
      "name": "fal",
      "url": "https://fal.ai/explore/worlds",
      "note": "Worlds catalog; model coverage must be checked at the destination."
    },
    {
      "name": "Reactor",
      "url": "https://www.reactor.inc/models",
      "note": "Model catalog; availability varies by model."
    },
    {
      "name": "Windflow",
      "url": "https://windflow.online/models",
      "note": "Maintainer-operated model catalog; availability varies by model."
    }
  ],
  "models": [
    {
      "id": "1x-world-model",
      "name": "1X World Model",
      "organization": "1X Technologies",
      "released": "2024-06",
      "category": "Robotics",
      "summary": "Models and data from the 1X World Model Challenge, which asks a model to predict the first-person camera view of 1X's EVE humanoid robot from its past frames and actions. The release includes small Genie-style baselines and a tokenizer; it is a research benchmark rather than an interactive app.",
      "controls": "Robot action and video modeling",
      "controlsDetail": [
        "Past camera frames from the robot",
        "The robot's action data for each step"
      ],
      "weights": "Available",
      "weightsUrl": "https://huggingface.co/1x-technologies/GENIE_138M",
      "weightLicense": "apache-2.0",
      "commercial": "Permissive license declared",
      "licenseNote": "The selected weight model card declares this license. Check the license text, dependencies and intended use before adoption.",
      "realtime": "Unverified",
      "measurement": "Not independently measured for this directory",
      "sources": [
        {
          "label": "Project source",
          "url": "https://github.com/1x-technologies/1xgpt"
        },
        {
          "label": "Weights and model card",
          "url": "https://huggingface.co/1x-technologies/GENIE_138M"
        }
      ],
      "tryAt": [],
      "checkedAt": "2026-10-23"
    },
    {
      "id": "abot-world",
      "name": "ABot-World",
      "organization": "AMAP CV Lab, Alibaba",
      "released": "2026-07",
      "category": "Navigation",
      "summary": "ABot-World turns a starting image into a world you move through with action inputs, generated frame by frame with no fixed end. Its authors target desktop hardware rather than data-center clusters, and the weights are Apache-2.0.",
      "controls": "Image and action-conditioned generation",
      "controlsDetail": [
        "A starting image",
        "A text prompt",
        "Movement and camera actions during the rollout"
      ],
      "weights": "Available",
      "weightsUrl": "https://huggingface.co/acvlab/ABot-World-0-5B-LF",
      "weightLicense": "apache-2.0",
      "commercial": "Permissive license declared",
      "licenseNote": "The selected weight model card declares this license. Check the license text, dependencies and intended use before adoption.",
      "realtime": "Author claim",
      "realtimeDetail": "720p at 16 fps with 1.2 s latency.",
      "measurement": "Not independently measured for this directory",
      "sources": [
        {
          "label": "Project source",
          "url": "https://github.com/amap-cvlab/ABot-World"
        },
        {
          "label": "Weights and model card",
          "url": "https://huggingface.co/acvlab/ABot-World-0-5B-LF"
        }
      ],
      "tryAt": [
        {
          "name": "fal",
          "url": "https://fal.ai/models/alibaba/abot-world-0",
          "note": "Listed destination; access, version and live capacity must be checked with the provider."
        },
        {
          "name": "Windflow",
          "url": "https://windflow.online/models/abot-world-0-5b",
          "note": "Listed destination; access, version and live capacity must be checked with the provider."
        }
      ],
      "checkedAt": "2026-10-23"
    },
    {
      "id": "agora",
      "name": "Agora (Odyssey)",
      "organization": "Odyssey",
      "released": "2026-05-18",
      "category": "Games",
      "summary": "Agora is Odyssey's multiplayer world model: up to four players act in the same generated world, and the model renders what each of them sees. The first public demo was a GoldenEye-style deathmatch; a newer version is playable on Odyssey's site.",
      "controls": "Up to four players act in one shared generated world",
      "controlsDetail": [
        "Each player's movement and actions",
        "One shared world for up to four players"
      ],
      "weights": "Not published in cited source",
      "weightsUrl": null,
      "weightLicense": "No public weight license verified",
      "commercial": "Service terms",
      "licenseNote": "Hosted service or research announcement. Service access does not grant a license to model weights.",
      "realtime": "Author claim",
      "realtimeDetail": "Real time for every player; no frame rate published.",
      "measurement": "Not independently measured for this directory",
      "sources": [
        {
          "label": "Official source",
          "url": "https://odyssey.systems/introducing-agora-1"
        }
      ],
      "tryAt": [
        {
          "name": "Official",
          "url": "https://agora.odyssey.systems/",
          "note": "Listed destination; access, version and live capacity must be checked with the provider."
        }
      ],
      "checkedAt": "2026-10-23"
    },
    {
      "id": "alayaworld",
      "name": "AlayaWorld",
      "organization": "Alaya Lab",
      "released": "2026-07",
      "category": "Navigation",
      "summary": "AlayaWorld is an open framework for playable generated worlds that ships pipelines, reference code and evaluation tools alongside its weights. Its authors demonstrate navigation plus actions such as combat and spell casting.",
      "controls": "Interactive world generation",
      "controlsDetail": [
        "Keyboard input",
        "Mouse input",
        "A text prompt"
      ],
      "weights": "Available",
      "weightsUrl": "https://huggingface.co/AlayaLab/AlayaWorld",
      "weightLicense": "LTX-2 Community License",
      "commercial": "Custom terms",
      "licenseNote": "The model card specifies the LTX-2 Community License, including a revenue-based commercial licensing condition.",
      "realtime": "Author claim",
      "realtimeDetail": "Real-time navigation and actions; no frame rate published.",
      "measurement": "Not independently measured for this directory",
      "sources": [
        {
          "label": "Project source",
          "url": "https://github.com/alaya-lab/AlayaWorld"
        },
        {
          "label": "Weights and model card",
          "url": "https://huggingface.co/AlayaLab/AlayaWorld"
        },
        {
          "label": "Paper",
          "url": "https://arxiv.org/abs/2607.06291"
        }
      ],
      "tryAt": [],
      "checkedAt": "2026-10-23"
    },
    {
      "id": "comma-worldmodel-4b",
      "name": "comma.ai world model 4B",
      "organization": "comma.ai",
      "released": "2026-09-01",
      "category": "Driving",
      "summary": "comma.ai's 4B driving world model predicts what the car's two cameras will see next, together with a driving plan, from recent frames and the car's own motion. comma uses it as a simulator to train openpilot driving policies with reinforcement learning; the weights are MIT.",
      "controls": "Frame history, ego motion and future plan anchors",
      "controlsDetail": [
        "Recent camera frames",
        "The car's ego motion",
        "Future anchors for the driving plan"
      ],
      "weights": "Available",
      "weightsUrl": "https://huggingface.co/commaai/worldmodel-4B",
      "weightLicense": "mit",
      "commercial": "Permissive license declared",
      "licenseNote": "The selected weight model card declares this license. Check the license text, dependencies and intended use before adoption.",
      "realtime": "Unverified",
      "measurement": "Not independently measured for this directory",
      "sources": [
        {
          "label": "Weights and model card",
          "url": "https://huggingface.co/commaai/worldmodel-4B"
        },
        {
          "label": "Paper",
          "url": "https://arxiv.org/abs/2504.19077"
        },
        {
          "label": "comma.ai blog",
          "url": "https://blog.comma.ai/mlsim/"
        }
      ],
      "tryAt": [],
      "checkedAt": "2026-10-23"
    },
    {
      "id": "cosmos-predict2-5",
      "name": "Cosmos Predict2.5",
      "organization": "NVIDIA",
      "released": "2025-09",
      "category": "Physical simulation",
      "summary": "Cosmos-Predict2.5 is NVIDIA's world foundation model for physical AI: it continues or generates video from text, an image or a clip. An action-conditioned variant predicts what a robot will see after an action, which makes it a simulator for policy work rather than a game engine.",
      "controls": "Text, image and video conditioning",
      "controlsDetail": [
        "A text prompt",
        "A starting image or video",
        "Robot actions (action-conditioned variant)"
      ],
      "weights": "Available",
      "weightsUrl": "https://huggingface.co/nvidia/Cosmos-Predict2.5-2B",
      "weightLicense": "NVIDIA Open Model License",
      "commercial": "Custom terms",
      "licenseNote": "It states that the models are commercially usable, with conditions: keep NVIDIA's license notice when you distribute the model, credit \"Built on NVIDIA Cosmos\", and do not bypass its safety guardrails.",
      "realtime": "Unverified",